{"schema_version":1,"command":"fresh","result":"answered","knowledge":{"revision":"eda18fdf1c171d59dd486cf56ab3b5a8d215d5e4","source":"plugin","pin_files":[],"override":true,"rules_schema":1,"feature_root":"docs/internal/plans","local_format":false},"data":{"default_branch":"main","remote":"origin","remote_sha":"9fb4e3bae58acc1995e2c22517b16dc6f72373fe","local_sha":"9fb4e3bae58acc1995e2c22517b16dc6f72373fe","spec_review":{"review":"R-1","commit":"c75b3f6","stale":false,"reasons":[]},"implementation_review":{"review":"R-2","commit":"1c581af","stale":false,"reasons":[]},"feature_tree":{"clean":true,"paths":[]}},"findings":[]}
