{"schema_version":1,"command":"next","result":"local-format","knowledge":{"revision":"eda18fdf1c171d59dd486cf56ab3b5a8d215d5e4","source":"plugin","pin_files":[],"override":true,"rules_schema":1,"feature_root":"docs/internal/plans","local_format":true},"data":null,"findings":[{"code":"local-format","message":"the repository declares its own feature-document format; the binary does not decide it","path":"AGENTS.md","line":0}]}
