{"schema_version":1,"command":"gate","result":"pass","knowledge":{"revision":"eda18fdf1c171d59dd486cf56ab3b5a8d215d5e4","source":"plugin","pin_files":[],"override":true,"rules_schema":1,"feature_root":"docs/","local_format":false},"data":{"document":"docs/f.md","current":"draft","target":"planned","transition":"allowed","failing":[],"line":"vh-adlc gate planned: pass (rules 1, docs eda18fd)"},"findings":[]}
