{"schema_version":1,"command":"gate","result":"fail","knowledge":{"revision":"eda18fdf1c171d59dd486cf56ab3b5a8d215d5e4","source":"plugin","pin_files":[],"override":true,"rules_schema":1,"feature_root":"docs/","local_format":false},"data":{"document":"docs/f.md","current":"draft","target":"complete","transition":"not-allowed","failing":["all_met","impl_review_fresh","impl_review_clean"],"line":"vh-adlc gate complete: fail (transition-not-allowed, all_met, impl_review_fresh, impl_review_clean; rules 1, docs eda18fd)"},"findings":[{"code":"all_met","message":"not ticked with evidence or residualised: AC-01, AC-02","path":"docs/f.md","line":0},{"code":"impl_review_clean","message":"there is no implementation review","path":"docs/f.md","line":0},{"code":"impl_review_fresh","message":"the latest implementation review is stale: no-review","path":"docs/f.md","line":0},{"code":"transition-not-allowed","message":"the rules do not allow draft to complete","path":"docs/f.md","line":0}]}
