{"schema_version":1,"command":"review check","result":"fail","knowledge":{"revision":"eda18fdf1c171d59dd486cf56ab3b5a8d215d5e4","source":"plugin","pin_files":[],"override":true,"rules_schema":1,"feature_root":"docs/","local_format":false},"data":{"review":"R-1","equal":false},"findings":[{"code":"records-differ","message":"the records stored under ### R-1 differ from the returned file","path":"docs/f.md","line":62}]}
