{"schema_version":1,"command":"gate","result":"fail","knowledge":{"revision":"e8565f0d9420d8697b422a98e85966723c78b31b","source":"plugin","pin_files":[],"override":true,"rules_schema":1,"feature_root":"docs/","local_format":false},"data":{"document":"docs/f.md","current":"draft","target":"planned","transition":"allowed","failing":["all_met"],"line":"vh-adlc gate planned: fail (all_met; rules 1, docs e8565f0)"},"findings":[{"code":"all_met","message":"not ticked with evidence or residualised: AC-01, AC-02","path":"docs/f.md","line":0}]}
